{
  "$schema": "https://json-schema.org/draft/2020-12/schema",
  "$id": "https://github.com/marcmalerei/gluon/schemas/package-contract.schema.json",
  "title": "Gluon package contract",
  "type": "object",
  "required": ["version", "releaseGroup", "versioning", "registry", "packages"],
  "properties": {
    "$schema": { "type": "string" },
    "version": { "const": 1 },
    "releaseGroup": { "type": "string", "minLength": 1 },
    "versioning": { "const": "lockstep" },
    "registry": {
      "type": "object",
      "required": ["url", "checkedAt", "scope", "scopeControl", "publicationState", "observation"],
      "properties": {
        "url": { "type": "string", "format": "uri" },
        "checkedAt": { "type": "string", "format": "date" },
        "scope": { "const": "@gluonjs" },
        "scopeControl": { "enum": ["unverified", "verified"] },
        "publicationState": { "enum": ["blocked", "ready", "released"] },
        "observation": { "type": "string", "minLength": 1 }
      },
      "additionalProperties": false
    },
    "packages": {
      "type": "array",
      "minItems": 1,
      "items": {
        "type": "object",
        "required": ["name", "directory", "state", "environment", "exports", "dependencies"],
        "properties": {
          "name": { "type": "string", "minLength": 1 },
          "directory": { "type": "string", "minLength": 1 },
          "state": { "enum": ["current", "planned"] },
          "environment": { "enum": ["browser", "node", "universal"] },
          "exports": { "type": "array", "minItems": 1, "items": { "type": "string" } },
          "finalExports": { "type": "array", "minItems": 1, "items": { "type": "string" } },
          "bins": { "type": "array", "minItems": 1, "items": { "type": "string" } },
          "currentDependencies": { "type": "array", "items": { "type": "string" } },
          "dependencies": { "type": "array", "items": { "type": "string" } }
        },
        "additionalProperties": false
      }
    }
  },
  "additionalProperties": false
}
