{
  "$schema": "./schemas/package-contract.schema.json",
  "version": 1,
  "releaseGroup": "gluon-framework",
  "versioning": "lockstep",
  "registry": {
    "url": "https://registry.npmjs.org",
    "checkedAt": "2026-10-02",
    "scope": "@gluonjs",
    "scopeControl": "verified",
    "publicationState": "released",
    "observation": "Independent post-publication verification on 2026-10-02 confirms protected tag v1.13.0 and the complete 22-package lockstep train at 1.13.0 with latest 1.13.0; the immutable GitHub release v1.13.0 is published."
  },
  "packages": [
    {
      "name": "@gluonjs/reactivity",
      "directory": "packages/reactivity",
      "state": "current",
      "environment": "universal",
      "exports": [".", "./signals", "./preact-signals"],
      "dependencies": []
    },
    {
      "name": "@gluonjs/compiler",
      "directory": "packages/compiler",
      "state": "current",
      "environment": "universal",
      "exports": [".", "./diagnostics"],
      "dependencies": []
    },
    {
      "name": "@gluonjs/core",
      "directory": ".",
      "state": "current",
      "environment": "browser",
      "exports": [".", "./decorators", "./styles", "./analytics", "./compat/lit"],
      "bins": ["gluon-skill"],
      "currentDependencies": ["@gluonjs/reactivity"],
      "dependencies": ["@gluonjs/reactivity"]
    },
    {
      "name": "@gluonjs/router",
      "directory": "packages/router",
      "state": "current",
      "environment": "browser",
      "exports": [".", "./memory"],
      "dependencies": ["@gluonjs/core", "@gluonjs/reactivity"]
    },
    {
      "name": "@gluonjs/store",
      "directory": "packages/store",
      "state": "current",
      "environment": "universal",
      "exports": ["."],
      "dependencies": ["@gluonjs/reactivity"]
    },
    {
      "name": "@gluonjs/i18n",
      "directory": "packages/i18n",
      "state": "current",
      "environment": "browser",
      "exports": ["."],
      "dependencies": ["@gluonjs/core", "@gluonjs/reactivity"]
    },
    {
      "name": "@gluonjs/ssr",
      "directory": "packages/ssr",
      "state": "current",
      "environment": "node",
      "exports": [".", "./eleventy", "./hydration", "./static", "./streaming", "./tenant"],
      "dependencies": [
        "@gluonjs/core",
        "@gluonjs/reactivity",
        "@gluonjs/router",
        "@gluonjs/store"
      ]
    },
    {
      "name": "@gluonjs/graphql",
      "directory": "packages/graphql",
      "state": "current",
      "environment": "universal",
      "exports": ["."],
      "dependencies": []
    },
    {
      "name": "@gluonjs/vite",
      "directory": "packages/vite",
      "state": "current",
      "environment": "node",
      "exports": [".", "./tailwind", "./tailwind.css"],
      "currentDependencies": ["@gluonjs/compiler", "@gluonjs/core"],
      "dependencies": ["@gluonjs/compiler"]
    },
    {
      "name": "@gluonjs/gluon-components-vite",
      "directory": "packages/gluon-components-vite",
      "state": "current",
      "environment": "browser",
      "exports": [".", "./entry-preview", "./preset", "./renderer-preset"],
      "currentDependencies": ["@gluonjs/core", "@gluonjs/ssr"],
      "dependencies": ["@gluonjs/core"]
    },
    {
      "name": "@gluonjs/test-utils",
      "directory": "packages/test-utils",
      "state": "current",
      "environment": "browser",
      "exports": [".", "./ssr"],
      "dependencies": [
        "@gluonjs/core",
        "@gluonjs/reactivity",
        "@gluonjs/router",
        "@gluonjs/ssr",
        "@gluonjs/store"
      ]
    },
    {
      "name": "@gluonjs/devtools-api",
      "directory": "packages/devtools-api",
      "state": "current",
      "environment": "universal",
      "exports": ["."],
      "dependencies": []
    },
    {
      "name": "@gluonjs/devtools",
      "directory": "packages/devtools",
      "state": "current",
      "environment": "browser",
      "exports": ["."],
      "dependencies": ["@gluonjs/core", "@gluonjs/devtools-api"]
    },
    {
      "name": "@gluonjs/graph",
      "directory": "packages/graph",
      "state": "current",
      "environment": "browser",
      "exports": ["."],
      "dependencies": ["@gluonjs/core"]
    },
    {
      "name": "@gluonjs/language-server",
      "directory": "packages/language-server",
      "state": "current",
      "environment": "node",
      "exports": ["."],
      "bins": [
        "gluon-language-server",
        "gluon-project-analyze",
        "gluon-template-check",
        "gluon-check",
        "gluon-mcp"
      ],
      "dependencies": ["@gluonjs/compiler"]
    },
    {
      "name": "@gluonjs/vue-migration-analyzer",
      "directory": "packages/vue-migration-analyzer",
      "state": "current",
      "environment": "node",
      "exports": [".", "./schema"],
      "bins": ["gluon-vue-analyze"],
      "dependencies": []
    },
    {
      "name": "@gluonjs/quarks",
      "directory": "packages/quarks",
      "state": "current",
      "environment": "browser",
      "exports": ["."],
      "dependencies": ["@gluonjs/core"]
    },
    {
      "name": "@gluonjs/atoms",
      "directory": "packages/atoms",
      "state": "current",
      "environment": "browser",
      "exports": ["."],
      "dependencies": ["@gluonjs/core", "@gluonjs/quarks"]
    },
    {
      "name": "@gluonjs/molecules",
      "directory": "packages/molecules",
      "state": "current",
      "environment": "browser",
      "exports": ["."],
      "dependencies": ["@gluonjs/core", "@gluonjs/quarks", "@gluonjs/atoms"]
    },
    {
      "name": "@gluonjs/organisms",
      "directory": "packages/organisms",
      "state": "current",
      "environment": "browser",
      "exports": ["."],
      "dependencies": [
        "@gluonjs/core",
        "@gluonjs/quarks",
        "@gluonjs/atoms",
        "@gluonjs/molecules"
      ]
    },
    {
      "name": "@gluonjs/json-forms",
      "directory": "packages/json-forms",
      "state": "current",
      "environment": "browser",
      "exports": ["."],
      "dependencies": ["@gluonjs/core"]
    },
    {
      "name": "create-gluon",
      "directory": "packages/create-gluon",
      "state": "current",
      "environment": "node",
      "exports": ["."],
      "bins": ["create-gluon"],
      "dependencies": []
    }
  ]
}
